{
  "schema_version": "chori-octodot.implementation-plan.v1",
  "project": "chori-octodot",
  "plan_version": "1.0.0",
  "created_at": "2026-10-07",
  "status": "planning_only",
  "authorizes_execution": false,
  "baseline": {
    "reported_offline_tests": 28,
    "statically_observed_test_methods": 28,
    "rerun_in_this_planning_pass": false,
    "source_inspection": "completed_read_only",
    "imported_in_this_repository": false,
    "live_gates_reproduced_in_this_planning_pass": false,
    "note": "Historical test and read-success reports are background only. S00 must reproduce the original baseline; this repository does not ship the prototype."
  },
  "architecture": {
    "runtime": "Portable Python 3.10+ CLI; standard-library HTTP and SQLite; POSIX lock support initially",
    "runtime_plan_schema": "jules-controller.plan.v1",
    "runtime_result_schema": "jules-controller.result.v1",
    "runtime_workflow": "Ordered named actions with typed backward read references, not a general DAG",
    "state": "Private durable per-profile SQLite with global workflow owner lock and trusted recovery fence",
    "mutation_default": "disabled",
    "suggestions_api": "unsupported_public_api",
    "activity_filter": "createTime, per-profile capability-gated; full scan remains correctness fallback",
    "excluded": [
      "merge",
      "deploy",
      "direct application code changes",
      "apply patches",
      "delete sessions",
      "private undocumented API",
      "new credential grants",
      "automatic publication",
      "daemon installation"
    ]
  },
  "permissions": {
    "P0": "Planning is not permission to implement. Begin implementation only under an explicit implementation assignment in an authorized environment; baseline source import must be authorized.",
    "P_READ": "Use existing authorized read access and exact selected scope; no new persistent credentials, permission prompts or outbound-control bypass. UI evidence requires authorized UI access.",
    "P_REPLY": "Current exact target/text/context permission plus trusted grant, approved actual receiver/channel and one POST maximum. Approval does not cover creation or plan approval.",
    "P_CREATE": "Separate permission for exact task content, source/repository/branch/marker and publication:none, one create attempt, requirePlanApproval=true.",
    "P_APPROVE": "Separate permission for reviewed latest plan ID/content hash and execution scope; disclose non-atomic server limitation; no publication scope implied."
  },
  "review_policy": {
    "id": "R1",
    "passes": [
      "Implementer runs specified finite tests and records final revision.",
      "One independent reviewer checks correctness and evidence.",
      "One independent challenger checks unsafe dispatch, data loss, identity drift and false success.",
      "At most one correction round with targeted recheck of findings plus affected aggregate tests."
    ],
    "stop": "If any required check or material finding remains unresolved, mark slice blocked and request maintainer decision. Do not loop indefinitely.",
    "review_is_not_authority": "Review completion never grants live mutation, merge or deployment permission."
  },
  "gates": [
    {
      "id": "G0",
      "name": "Reproduced baseline",
      "requires_slices": [
        "S00"
      ],
      "permission": "P0",
      "pass": "Original 28 offline tests rerun unchanged privately; sanitized public mirror preserves behavior; no private data published.",
      "failure": "Stop baseline import/refactor; retain historical status as unverified current."
    },
    {
      "id": "G1",
      "name": "Frozen executable contracts",
      "requires_slices": [
        "S01"
      ],
      "permission": "P0",
      "pass": "Strict schemas, canonical hashes, type ports, examples and finite acceptance rules approved.",
      "failure": "Dependent implementation blocked until contract resolved."
    },
    {
      "id": "G2",
      "name": "Offline core release",
      "requires_slices": [
        "S14"
      ],
      "permission": "P0",
      "pass": "Baseline plus all core offline suites pass at exact revision; reviewer/challenger resolved; live mutations disabled.",
      "failure": "No live gates; fix only under assigned scope."
    },
    {
      "id": "G3",
      "name": "Read-only UI and API parity",
      "requires_slices": [
        "S15"
      ],
      "permission": "P_READ",
      "pass": "Exact existing UI session/activity verified with bounded GETs and complete claimed scope; zero POST.",
      "failure": "Read capability remains unverified/partial; G4 blocked."
    },
    {
      "id": "G3-F",
      "name": "Optional timestamp capability",
      "requires_slices": [
        "S13",
        "S15"
      ],
      "permission": "P_READ",
      "pass": "Read-only full/filtered comparison supports this profile; fallback/overlap/full reconciliation active.",
      "failure": "Optimization stays disabled; G3 and core release can pass independently."
    },
    {
      "id": "G4",
      "name": "Explicitly approved reply round trip",
      "requires_slices": [
        "S16"
      ],
      "permission": "P_REPLY",
      "pass": "All UI/API/event/receiver/channel/reply/UI legs evidenced separately, at most one POST.",
      "failure": "No two-way relay claim; unknown result only reconciled through reads."
    },
    {
      "id": "G5",
      "name": "Optional exact task creation",
      "requires_slices": [
        "S17"
      ],
      "permission": "P_CREATE",
      "pass": "One creation verified against exact source/branch; plan approval required; automatic publication omitted.",
      "failure": "No repeat create; preserve accepted_identity_unverified or unknown."
    },
    {
      "id": "G6",
      "name": "Optional exact reviewed plan approval",
      "requires_slices": [
        "S18"
      ],
      "permission": "P_APPROVE",
      "pass": "Fresh reviewed plan context and matching approval event; non-atomic limitation retained.",
      "failure": "No repeat approval; no execution-success/publication inference."
    }
  ],
  "wave_policy": {
    "dependency_rule": "All depends_on slices and entry_gates must be accepted before starting; numeric wave is the earliest wave, not a global barrier.",
    "parallelism": "Within a wave, independent slices with disjoint allowed_files can run in parallel. Shared contracts remain read-only after S01.",
    "conflict_rule": "A needed edit outside allowed_files stops that slice for a scoped handoff; do not expand the file list silently.",
    "integration": "S14 is the sole core registry/package/documentation integrator. Optional slices register only through an explicitly reviewed integration change after their acceptance.",
    "live_order": "G2 -> G3 -> G4 -> optional G5 -> optional G6. G3-F and provider releases are optional and do not gate the core.",
    "acceptance_invocation": "Before a live mutation gate passes, the corresponding normal capability remains disabled. Once its prerequisite gate passes, a specifically issued acceptance grant permits only that one exact gate invocation through the same verifier, recovery fence and journal with max_posts=1. G4 follows G3, G5 follows G4, and G6 follows G5. The acceptance grant is not a general bypass and cannot be replayed or converted into ordinary access; a passing gate also never replaces future current grants."
  },
  "failure_semantics": {
    "statuses": [
      "ok",
      "waiting",
      "partial",
      "unsupported",
      "blocked",
      "rejected",
      "unknown",
      "skipped_dependency",
      "interrupted"
    ],
    "exit_codes": {
      "0": "All requested operations completed",
      "2": "Waiting or invocation budget yielded",
      "3": "Invalid input or fatal read/local failure",
      "4": "Mutation blocked, rejected or unknown",
      "5": "Partial/unsupported result",
      "130": "Interrupted"
    },
    "precedence": [
      "130",
      "4",
      "3",
      "5",
      "2",
      "0"
    ],
    "rules": [
      "JSON is authoritative and preserves every action result; remote task FAILED is an observed outcome, not automatically controller failure.",
      "Whole-plan invalidity stops before credential/network access; failed dependency skips only dependents; independent reads continue.",
      "Any blocked/rejected/unknown mutation stops all following mutations in that invocation; reads and reconciliation may continue.",
      "Partial coverage cannot advance complete checkpoint, establish absence or authorize a write.",
      "A deadline yields a durable job; it does not cancel an authorized watch.",
      "Unknown POST is never automatically retried, including after restart, missing state, new operation ID or repeated absence.",
      "Use accepted_identity_unverified for valid creation response with missing binding verification.",
      "Outbox acceptance and channel-send acceptance are distinct; ambiguous send remains delivery_unknown."
    ]
  },
  "finite_validation": {
    "per_test_timeout_seconds": 30,
    "per_suite_timeout_seconds": 600,
    "aggregate_ci_timeout_minutes": 20,
    "fake_clock_required_for_polling": true,
    "live_invocation_defaults": {
      "deadline_seconds": 180,
      "request_timeout_seconds": 20,
      "max_http_requests": 120,
      "max_posts": 0,
      "max_pages": 100,
      "max_sessions": 200,
      "max_response_bytes": 8388608,
      "max_total_bytes": 33554432,
      "max_output_bytes": 65536
    },
    "live_mutation_override": "Only exact authorized mutation gate may raise max_posts from 0 to 1. Never raise after dispatch; invocation exhaustion yields read-only reconciliation.",
    "budget_exhaustion": "Mark incomplete/blocked or waiting with a durable resume reference. Do not silently expand caps; request a scoped budget change where necessary."
  },
  "public_evidence_policy": {
    "allowed": [
      "gate ID/status",
      "software revision",